Código,Nome da Sociedade,Data,Data_original,Endereço,Licença,Estatuto,Notação-GIFI,Tipo de licença,Obs,Presidente,Licença anterior,Nomes/Sujeitos,Doc policial,Tipo_licenca_categoria,Tipo_licenca_componentes
831,sociedade carnavalesca recordações do passado,1914-02-20,20/02/1914,"rua são carlos, 56",1,0,6c408,sair no carnaval,,,0,0,0,desfile_carnavalesco,desfile_carnavalesco
832,clube carnavalesco recreativo retiro da américa,1914-02-18,18/02/1914,"rua da saude, 333",1,0,6c408,licença anual e para sair no carnaval,,,0,0,0,desfile_anual,desfile_carnavalesco|licenca_anual
833,grupo carnavalesco vamos provar da petisqueira,1914-02-18,18/02/1914,"rua visconde de sapucaí, 31",1,0,6c408,sair no carnaval,,,0,0,0,desfile_carnavalesco,desfile_carnavalesco
834,grupo infantil,1914-02-20,20/02/1914,"rua borges, 42",1,0,6c408,sair no carnaval,,,0,0,0,desfile_carnavalesco,desfile_carnavalesco
835,sociedade dançante carnavalesca guerreiros de são diogo,1914-02-09,09/02/1914,"rua dr. Nabuco de freitas, 171",1,0,6c408,licença anual e para sair no carnaval,,,0,0,0,desfile_anual,desfile_carnavalesco|licenca_anual
836,grêmio carnavalesco infantil filho do jasmim de ouro,1914-01-28,28/01/1914,"ladeira do peixoto, 73",1,0,6c408,licença anual e para sair no carnaval,,,0,0,0,desfile_anual,desfile_carnavalesco|licenca_anual
837,grupo carnavalesco flor do amor,1914-02-09,09/02/1914,"rua barão, 55",1,0,6c408,sair no carnaval,,manoel de lima júnior,0,0,0,desfile_carnavalesco,desfile_carnavalesco
838,grêmio canravalesco encrenca do encantado,1914-01-31,31/01/1914,,0,0,6c408,sair no carnaval,,augusto berbesieh,0,0,0,desfile_carnavalesco,desfile_carnavalesco
839,grupo carnavalesco caprichosos de hanquieta (anchieta),1914-02-22,22/02/1914,anchieta,0,0,6c408,sair no carnaval,,augusto berbesieh,0,0,0,desfile_carnavalesco,desfile_carnavalesco
840,grupo carnavalesco flor da mocidade de são diogo,1914-02-22,22/02/1914,"rua visconde de itauna, 343",0,0,6c408,sair no carnaval,,sebastião ferreira pacheco,0,0,0,desfile_carnavalesco,desfile_carnavalesco
841,paladino clube,1914-02-19,19/02/1914,"rua general camara, 241",0,0,6c408,sair no carnaval,,,1,0,0,desfile_carnavalesco,desfile_carnavalesco
842,clube carnavalesco flor do andaraí,1914-02-16,16/02/1914,"rua barão de mesquita, 994",0,0,6c408,sair no carnaval,"socios, croquis",antonio reis (secretario),0,1,0,desfile_carnavalesco,desfile_carnavalesco
843,grêmio dançante carnavalesco magnolia,1914-01-28,28/01/1914,"rua s. carlos, 76",1,0,6c408,licença anual e sair no carnaval,,,1,0,0,desfile_anual,desfile_carnavalesco|licenca_anual
844,grupo carnavalesco democráticos de sta cruz,1914-01-30,30/01/1914,"rua felipe cardoso, 32",1,0,6c408,licença anual e sair no carnaval,,,1,0,0,desfile_anual,desfile_carnavalesco|licenca_anual
845,sociedade carnavalesco filhos da deuza do paraiso,1914-02-04,04/02/1914,"largo dos ?, 8",1,0,6c408,licença anual e sair no carnaval,,,0,0,0,desfile_anual,desfile_carnavalesco|licenca_anual
846,grupo carnavalesco ca??? De madureira,1914-02-12,12/02/1914,"rua domingos fernandes, 9",1,0,6c408,licença anual e sair no carnaval,,,1,0,0,desfile_anual,desfile_carnavalesco|licenca_anual
847,sociedade dançante familiar carnavalesca flor da roma,1914-02-20,20/02/1914,"rua d. marciano, 153",1,0,6c408,licença anual e sair no carnaval,,,0,0,0,desfile_anual,desfile_carnavalesco|licenca_anual
848,grêmio carnavalesco triunfo do engenho de dentro,1914-01-13,13/01/1914,"rua luiza, 38",1,0,6c408,licença anual e sair no carnaval,,,1,0,0,desfile_anual,desfile_carnavalesco|licenca_anual
849,grêmio carnavalesco endiabrados dos cajueiros,1914-01-19,19/01/1914,"rua guanabara, 49",1,0,6c408,licença anual e sair no carnaval,,,0,0,0,desfile_anual,desfile_carnavalesco|licenca_anual
850,grupo carnavalesco atraentes Do Rio Grande,1914-02-16,16/02/1914,jacarepagiá,1,0,6c408,licença anual e sair no carnaval,,,1,0,0,desfile_anual,desfile_carnavalesco|licenca_anual
851,grupo carnavalesco triunfo do amor,1914-01-26,26/01/1914,"rua luiza, 91",1,0,6c408,licença anual e sair no carnaval,,,0,0,0,desfile_anual,desfile_carnavalesco|licenca_anual
852,rancho carnavalesco segredo dos semprevivos,1914-02-04,04/02/1914,"rua senador euzebio, 540",1,0,6c408,licença anual e sair no carnaval,,,0,0,0,desfile_anual,desfile_carnavalesco|licenca_anual
853,clube carnavalesco destemidos do conselheiros,1914-02-14,14/02/1914,"rua conselheiro zacharias, 148",1,0,6c408,licença anual e sair no carnaval,,,0,0,0,desfile_anual,desfile_carnavalesco|licenca_anual
854,clube dos furrecos,1914-02-16,16/02/1914,sta cruz,1,0,6c408,sair no carnaval,,,0,0,0,desfile_carnavalesco,desfile_carnavalesco
855,grupo infantil salvador de sá,1914-02-16,16/02/1914,"rua d. julia, 29",1,0,6c408,sair no carnaval,,,0,0,0,desfile_carnavalesco,desfile_carnavalesco
856,grupo carnavalesco estrela da vaidade,1914-02-18,18/02/1914,"rua laurindo rabello, 90",0,0,6c408,sair no carnaval,,,0,0,0,desfile_carnavalesco,desfile_carnavalesco
857,grupo carnavalesco caprichosos da estrada real,1914-01-27,27/01/1914,"rua borges, 39",1,0,6c408,sair no carnaval,,,0,0,0,desfile_carnavalesco,desfile_carnavalesco
858,grupo carnavalesco mimosos malmequer,1914-01-22,22/01/1914,"rua campos da paz, 86",1,0,6c408,sair no carnaval,socios e profissões,,0,1,0,desfile_carnavalesco,desfile_carnavalesco
859,sociedade carnavalesca reinado das formigas carregadeiras,1914-02-06,06/02/1914,inhaúma,1,0,6c408,sair no carnaval,,,0,0,0,desfile_carnavalesco,desfile_carnavalesco
860,grupo aperta arruela,1914-01-29,29/01/1914,"rua miguel sayão, 7",1,0,6c408,sair no carnaval,,,0,0,0,desfile_carnavalesco,desfile_carnavalesco
861,grupo carnavalesco triunfo da  mocidade,1914-02-09,09/02/1914,"rua da américa, 84",1,0,6c408,sair no carnaval,,,0,0,0,desfile_carnavalesco,desfile_carnavalesco
862,grupo carnavalesco união de todos,1914-02-11,11/02/1914,"rua miguel de pauva, 35",1,0,6c408,sair no carnaval,,,0,0,0,desfile_carnavalesco,desfile_carnavalesco
863,grupo carnavalesco filho do peixe,1914-02-16,16/02/1914,"escadinha do barroso, 20",1,0,6c408,sair no carnaval,,,0,0,0,desfile_carnavalesco,desfile_carnavalesco
864,bloco dos rodinhas,1914-02-19,19/02/1914,"rua são pedro, 106",1,0,6c408,sair no carnaval com cinco carros alegóricos,,,0,0,0,desfile_carnavalesco,carros_alegorias|desfile_carnavalesco
865,grupo familiar,1914-02-16,16/02/1914,"rua visconde de sapucahy, 201",1,0,6c408,sair no carnaval com grupo de pessoas de sua família,,paulo da cruz e silva,0,0,0,desfile_carnavalesco,desfile_carnavalesco
866,sociedade dançante carnavalesc cartolas de são diogo,1914-02-16,16/02/1914,"rua general pedra, 169",1,0,6c408,sair no carnaval,,,0,0,0,desfile_carnavalesco,desfile_carnavalesco
867,paladino clube,1914-02-19,19/02/1914,"rua general camara, 241",1,0,6c408,licença anual,,,1,0,0,licenca_anual,licenca_anual
868,clube familiar união do catete,1914-01-21,21/01/1914,"rua do catete, 257",1,0,6c408,licença anual,,,1,0,0,licenca_anual,licenca_anual
869,sociedade gesangverin lira,1914-01-21,21/01/1914,"rua dos andradas, 59",1,0,6c408,licença anual,empregados da cervejaria brahma,,1,0,0,licenca_anual,licenca_anual
870,clube carnavalesco democráticos de frontin,1914-01-05,05/01/1914,"rua elias da silva, 251",1,0,6c408,licença anual,,,0,0,0,licenca_anual,licenca_anual
871,clube bohemios carnavalescos,1914-01-16,16/01/1914,rua assis carneiro. 169,1,0,6c408,licença anual,,,0,0,0,licenca_anual,licenca_anual
872,grêmio dramático paz e amor,1914-01-23,23/01/1914,"rua nabuco de freitas, 118",1,0,6c408,licença anual,,,0,0,0,licenca_anual,licenca_anual
873,sociedade dançante carnavalesca mimoso miosoty,1914-02-16,16/02/1914,"rua do catete, 343",0,0,6c408,licença anual,,,0,0,0,licenca_anual,licenca_anual
874,clube mozaart,1914-01-17,17/01/1914,"rua chile, 31",0,0,6c408,licença anual,debates,,1,0,0,licenca_anual,licenca_anual
875,clube dos pepinos,1914-01-26,26/01/1914,"rua dr. Niemeyer, 69",1,0,6c408,licença anual,,,1,0,0,licenca_anual,licenca_anual
876,clube dos mokas,1914-01-17,17/01/1914,"rua do estácio de sá, 77",1,0,6c408,passeata no dia 20/01,,,0,0,0,passeata,passeata
877,zé-pereira [anúncios],1914-01-12,12/01/1914,"rua bella de são joão, 89",1,0,6c408,licença para tocar e sair com zé pereira,,carlos ferreira,0,0,0,desfile_carnavalesco,desfile_carnavalesco|ze_pereira
878,sociedade dançante carnavalesca suspiros do amor,1913-12-23,23/12/1913,"rua dr. Pauo de frontin, 93, d. clara",1,0,6c408,licença anual,operários,,0,0,0,licenca_anual,licenca_anual
879,sociedade dançante carnavalesca ameno resedá,1914-01-19,19/01/1914,"rua correa dutra, 131",1,0,6c408,licença anual,,oswaldo coutinho,0,0,0,licenca_anual,licenca_anual
880,clube dos fenianos,1914-01-06,06/01/1914,"travessa de são francisco de paula, 38",1,0,6c408,licença anual,,luiz silva (secretario),0,0,0,licenca_anual,licenca_anual
881,clube dos mokas,1914-01-17,17/01/1914,"rua do estácio de sá, 77",1,0,6c408,licença anual,,,0,0,0,licenca_anual,licenca_anual
882,sociedade triunfo da mocidade,1913-12-13,13/12/1913,"rua da américa, 84",0,1,6c408,realizar ensaios,empregados no comércio e trabalhadores ordeiros,,1,0,0,ensaio,ensaio
883,clube carnavalesco resistentes da piedade,1913-12-15,15/12/1913,"rua assis carneiro, 14",1,0,6c408,licença anual,,,0,0,0,licenca_anual,licenca_anual
884,clube carnavalesco filhos da pátria,1914-01-05,05/01/1914,"rua da gambôa, 13",0,0,6c408,licença anual,operários,,0,0,0,licenca_anual,licenca_anual
885,grupo carnavalesco união das estrelas,1913-12-31,31/12/1913,"rua da caridade, 64",1,0,6c408,licença anual,,,0,0,0,licenca_anual,licenca_anual
886,clube carnavalesco filhos do castelo de ouro,1914-01-19,19/01/1914,"ladeira do seminparios, 48",1,0,6c408,licença anual e sair no carnaval,,,1,0,0,desfile_anual,desfile_carnavalesco|licenca_anual
887,clube dos progressistas de santa cruz,1914-01-20,20/01/1914,sta cruz,1,0,6c408,licença anual e sair no carnaval,,,1,0,0,desfile_anual,desfile_carnavalesco|licenca_anual
888,grupo carnavalesco teimosos da terra noca,1914-01-26,26/01/1914,estrada nova da pavuna,1,1,6c408,"aprovação de estatutos, licença anual e sair no carnaval",,,0,0,0,estatutos_anual_desfile,desfile_carnavalesco|estatutos|licenca_anual
889,grupo carnavalesco coração de ouro,1914-02-20,20/02/1914,niterói,0,0,6c408,sair no carnaval,,,0,0,0,desfile_carnavalesco,desfile_carnavalesco
890,clube dos zuavos  carnavalescos,1914-02-20,20/02/1914,"rua maranguape, 24",1,0,6c408,passeta dia 23/02,croquis,rubem conceição (secretario),0,0,0,passeata,passeata
891,sociedade familiar dançante carnavalesca a chave está aqui,1914-01-31,31/01/1914,"rua dos coqueiros, 37",1,0,6c408,sair no carnaval,,,0,0,0,desfile_carnavalesco,desfile_carnavalesco
892,sociedade pingas carnavalescas,1914-01-26,26/01/1914,"rua engenho de dentro, 71",1,0,6c408,licença anual,,,0,0,0,licenca_anual,licenca_anual
893,clube dos democráticos de madureira,1914-01-23,23/01/1914,"rua domingos lopes, 269",1,1,6c408,"aprovação de estatutos, licença anual,",,,0,0,0,estatutos_anual,estatutos|licenca_anual
894,grupo carnavalesco guerreiros do farias,1914-02-19,19/02/1914,"ladeira do faria, 64",0,0,6c408,sair no carnaval,,,0,0,0,desfile_carnavalesco,desfile_carnavalesco
895,clube dançante carnavalesco reino da lua,1914-02-09,09/02/1914,estrada da tijuca,1,0,6c408,sair no carnaval,,,0,0,0,desfile_carnavalesco,desfile_carnavalesco
896,grupo dos avacelhudos [?],1914-02-05,05/02/1914,catumby,0,0,6c408,sair no carnaval,,,0,0,0,desfile_carnavalesco,desfile_carnavalesco
897,grupo carnavalesco flor da magnólia,1914-02-12,12/02/1914,,0,0,6c408,sair no carnaval,,,1,0,0,desfile_carnavalesco,desfile_carnavalesco
898,clube carnavalesco flor do anadarai,1914-01-31,31/01/1914,"rua barão de mesquita, 944",1,0,6c408,licença anual,,,0,0,0,licenca_anual,licenca_anual
899,grupo carnavalesco infantil de sta cruz,1914-01-31,31/01/1914,sta cruz,1,0,6c408,"aprovação de estatutos, licença anual, sair n carnaval",,,0,0,0,estatutos_anual_desfile,desfile_carnavalesco|estatutos|licenca_anual
900,grupo carnavalesco filhos da matta,1914-02-21,21/02/1914,"morro de s. lourenço, 16",1,0,6c408,sair no carnaval,,,0,0,0,desfile_carnavalesco,desfile_carnavalesco
901,grupo carnavalesco somos irmãos,1914-02-20,20/02/1914,"rua do riachuelo, 111",1,0,6c408,sair no carnaval,,,0,0,0,desfile_carnavalesco,desfile_carnavalesco
902,grupo carnavalesco estrela de ouro,1914-02-21,21/02/1914,niteroi,0,0,6c408,sair no carnaval,,,0,0,0,desfile_carnavalesco,desfile_carnavalesco
903,sociedade dançante carnavalesca brilho das moças,1914-02-18,18/02/1914,"rua dr. Manoel victorino, 256",1,0,6c408,sair no carnaval,,,0,0,0,desfile_carnavalesco,desfile_carnavalesco
904,sociedade carnavalesca borboletas vaidosas,1914-02-20,20/02/1914,jacarepagua,1,0,6c408,sair no carnaval,,,0,0,0,desfile_carnavalesco,desfile_carnavalesco
905,clube dos furrecas,1914-02-26,26/02/1914,sta cruz,1,0,6c408,licença anual,,,0,0,0,licenca_anual,licenca_anual
906,sociedade recreativa carnavalesca perfume das flores,1914-01-16,16/01/1914,ilha do governador,1,0,6c408,licença anual,,,0,0,0,licenca_anual,licenca_anual
907,sociedade dançante paladinos brasileiros,1914-01-15,15/01/1914,"rua senador euzebio, 10",1,0,6c408,licença anual e sair no carnaval,,,0,0,0,desfile_anual,desfile_carnavalesco|licenca_anual
908,grupo carnavalesco estrela de prata,1914-01-28,28/01/1914,"rua fagima, 76, sepetiba",1,1,6c408,"aprovação de estatutos, licença anual, sair n carnaval",,,0,0,0,estatutos_anual_desfile,desfile_carnavalesco|estatutos|licenca_anual
909,grêmio carnavalesco filhos dos tres jacarés,1914-01-28,28/01/1914,"rua pedro telles, 33",1,0,6c408,licença anual e sair no carnaval,,,0,0,0,desfile_anual,desfile_carnavalesco|licenca_anual
910,grupo carnavalesco como é... Eu não provo da sopa,1914-02-17,17/02/1914,"rua dr. Rego barros, 41",0,0,6c408,sair no carnaval,,,0,0,0,desfile_carnavalesco,desfile_carnavalesco
911,clube de cascadura,1914-02-21,21/02/1914,"rua d. pedro, 113'",0,0,6c408,sair no carnaval,croquis e itinerário,carlos coutinho,1,0,0,desfile_carnavalesco,desfile_carnavalesco
912,clube dos mokas,1914-02-19,19/02/1914,"rua estácio de sá, 77",0,0,6c408,sair no carnaval,croquis,,0,0,0,desfile_carnavalesco,desfile_carnavalesco
913,clube dos endiabrados dos coqueiros,1914-01-24,24/01/1914,"rua guanabara, 49",1,0,6c408,sair no carnaval,,,1,0,0,desfile_carnavalesco,desfile_carnavalesco
914,grupo carnavalesco paz e amor,1913-12-23,23/12/1913,ilha do governdor,1,0,6c408,licença anual e mudança de nome,,,1,0,0,licenca_anual,licenca_anual|mudanca_administrativa
915,clube tenentes do diabo,1914-02-23,23/02/1914,rua do passeio,1,0,6c408,siar dia 24/02,itinerário,,1,0,0,desfile_carnavalesco,desfile_carnavalesco
916,clube carnavalesco teimosos de madureira,1914-02-20,20/02/1914,"rua marechal rangel, 220",1,0,6c408,sair no carnaval,,,0,0,0,desfile_carnavalesco,desfile_carnavalesco
917,bloco carnavalesco kiosque saudade ideal,1914-02-23,23/02/1914,"praça maua, 73",1,0,6c408,passeata 23 e 24/02,,,0,0,0,passeata,passeata
918,grupo carnavalesco pérola do amor,1914-02-21,21/02/1914,"rua presidente barroso, 24",1,0,6c408,sair no carnaval,,,0,0,0,desfile_carnavalesco,desfile_carnavalesco
919,grupo carnavalesco pingo de ouro,1914-02-07,07/02/1914,rua deolinda 25,1,0,6c408,sair no carnaval,,,0,0,0,desfile_carnavalesco,desfile_carnavalesco
920,grupo carnavalesco lira dos lavradores,1914-02-12,12/02/1914,guaratiba,1,0,6c408,sair no carnaval,,,0,0,0,desfile_carnavalesco,desfile_carnavalesco
921,grupo carnavalesco flor da lavra,1914-02-12,12/02/1914,guaratiba,1,0,6c408,sair no carnaval,,,0,0,0,desfile_carnavalesco,desfile_carnavalesco
922,grupo carnavalesco relampagos de guaratiba,1914-02-12,12/02/1914,guaratiba,1,0,6c408,sair no carnaval,,,0,0,0,desfile_carnavalesco,desfile_carnavalesco
923,grupo carnavalesco flor do mato alto,1914-02-12,12/02/1914,guaratiba,1,0,6c408,sair no carnaval,,,0,0,0,desfile_carnavalesco,desfile_carnavalesco
924,sociedade dançante habitantes da lua,1914-01-19,19/01/1914,"rua pedro américo, 32",1,0,6c408,licença anual,,,0,0,0,licenca_anual,licenca_anual
925,grupo carnavalesco afilhados do prazer do castelo,1914-02-21,21/02/1914,"rua olicia maia, 23, madureira",1,0,6c408,sair no carnaval,crianças,,0,0,0,desfile_carnavalesco,desfile_carnavalesco
926,clube carnavalesco rainha das flores,1914-02-12,12/02/1914,ilha do governador,1,0,6c408,sair no carnaval,,,0,0,0,desfile_carnavalesco,desfile_carnavalesco
927,grupo carnavalesco união das mariposas,1914-02-19,19/02/1914,"rua theodoro da silva, 149",1,0,6c408,sair no carnaval,,,0,0,0,desfile_carnavalesco,desfile_carnavalesco
928,sociedade dançante carnavalesca paraiso das flores,1914-02-17,17/02/1914,ilha do governador,1,0,6c408,sair no carnaval,,,1,0,0,desfile_carnavalesco,desfile_carnavalesco
929,sociedade dançante carnavalesca suspiro do amor,1914-01-29,29/01/1914,"rua dr. Paulo de frontin, 93",1,0,6c408,sair no carnaval,debate,,1,0,0,desfile_carnavalesco,desfile_carnavalesco
930,bloco carnavalesco carestia da vida,1914-02-19,19/02/1914,"rua dr. Leal, 12",0,0,6c408,sair no carnaval,,,0,0,0,desfile_carnavalesco,desfile_carnavalesco
931,clube carnavalesco perfume das flores,1914-02-22,22/02/1914,"rua formaosa, ilha do governador",0,0,6c408,sair no carnaval,,,0,0,0,desfile_carnavalesco,desfile_carnavalesco
932,grupo das ostras,1914-02-17,17/02/1914,"praça marechal deodoro, 69",1,0,6c408,sair no carnaval,itinerário e croqui,luis santos,0,0,0,desfile_carnavalesco,desfile_carnavalesco
933,rancho carnavalesco amor perfeito,1914-02-14,14/02/1914,copacabana,0,0,6c408,sair no carnaval,,,0,0,0,desfile_carnavalesco,desfile_carnavalesco
934,grupo carnavalesco cartolas do alcantara,1914-02-20,20/02/1914,"rua benedicto hyppolito, 217",1,0,6c408,sair no carnaval,,,0,0,0,desfile_carnavalesco,desfile_carnavalesco
935,sociedade dançante carnavalesca flor das bananeiras,1914-02-11,11/02/1914,"rua carlos zavier, 64, d. clara",1,0,6c408,sair no carnaval,debate,,1,0,0,desfile_carnavalesco,desfile_carnavalesco
936,grêmio carnavalesco filhos do oceano,1914-01-22,22/01/1914,sepetiba,1,1,6c408,"aprovação de estatutos, licença anual e sair no carnaval",,,0,0,0,estatutos_anual_desfile,desfile_carnavalesco|estatutos|licenca_anual
937,sociedade carnavalesca união das rosas,1914-01-21,21/01/1914,"rua maria josé, 66",1,0,6c408,licença anual e sair no carnaval,,,1,0,0,desfile_anual,desfile_carnavalesco|licenca_anual
938,sociedade dançante carnavalesca ideal dos amores,1913-12-30,30/12/1913,"rua carlos gomes, 97",1,0,6c408,licença anual e sair no carnaval,operários,,1,0,0,desfile_anual,desfile_carnavalesco|licenca_anual
939,clube carnavalesco filhos dos caprichosos dos cajueiros,1914-02-11,11/02/1914,"rua senador pompeu, 254",1,0,6c408,licença anual e sair no carnaval,,,0,0,0,desfile_anual,desfile_carnavalesco|licenca_anual
940,sociedade dançante carnavalesca prazer da mociedade da cidade nova,1914-02-17,17/02/1914,"rua barão de angra, 22",1,1,6c408,licença anual e sair no carnaval,,,0,0,0,desfile_anual,desfile_carnavalesco|licenca_anual
941,sociedade carnavalesca pingas de bangu,1914-02-18,18/02/1914,"estrada real de sta cruz, 266",0,0,6c408,licença anual e sair no carnaval,,,0,0,0,desfile_anual,desfile_carnavalesco|licenca_anual
942,grêmio carnavalesco prazer do castelo,1914-01-15,15/01/1914,"rua do castelo, 13",1,0,6c408,licença anual e sair no carnaval,,,1,0,0,desfile_anual,desfile_carnavalesco|licenca_anual
943,grêmio carnavalesco frascorebos,1914-01-28,28/01/1914,"rua de sta ana, 79",1,0,6c408,licença anual e sair no carnaval,,,1,0,0,desfile_anual,desfile_carnavalesco|licenca_anual
944,sociedade dançante carnavalesca vamos ver para o futuro,1914-01-27,27/01/1914,"rua senhor de marozinho, 84",1,1,6c408,"aprovação de estatutos, licença anual e sair no carnaval",,,0,0,0,estatutos_anual_desfile,desfile_carnavalesco|estatutos|licenca_anual
945,sociedade dançante carnavalesca bateria do inferno,1914-01-29,29/01/1914,"rua isidoro gonçalves, 17",1,0,6c408,licença anual e sair no carnaval,,felix moreira de jesus,1,0,0,desfile_anual,desfile_carnavalesco|licenca_anual
946,grupo carnavalesco amadores e familiar,1914-02-04,04/02/1914,"rua maria teixeira, s/n,",1,0,6c408,licença anual e sair no carnaval,,,0,0,0,desfile_anual,desfile_carnavalesco|licenca_anual
947,grupo carnavalesco filhos da candinha,1914-02-18,18/02/1914,"rua do livramento, 91",1,0,6c408,sair no carnaval,,,0,0,0,desfile_carnavalesco,desfile_carnavalesco
948,rancho carnavalesco macaco é outro,1914-01-29,29/01/1914,"rua benedicto hyppolito, 210",1,0,6c408,licença anual e sair no carnaval,sócios e diretoria,manoel agobar da silva,0,1,0,desfile_anual,desfile_carnavalesco|licenca_anual
949,sociedade dançante carnavalesca destemidos das flores da cidade nova,1914-02-17,17/02/1914,"rua d. felicidade, 15",1,1,6c408,"aprovação de estatutos, licença anual e sair no carnaval",,,0,0,0,estatutos_anual_desfile,desfile_carnavalesco|estatutos|licenca_anual
950,grêmio carnavalesco martires da inveja do engenho de dentro,1914-01-28,28/01/1914,"rua luiza, 43",1,0,6c408,licença anual e sair no carnaval,,,1,0,0,desfile_anual,desfile_carnavalesco|licenca_anual
951,grupo carnavalesco união das florestas,1914-01-27,27/01/1914,campo grande,1,0,6c408,licença anual e sair no carnaval,,,1,0,0,desfile_anual,desfile_carnavalesco|licenca_anual
952,sociedade dançante carnavalesca chiveiro de prata,1913-01-23,23/01/1913,rua  da passagem 84,0,0,6c432,licença anual e sair no carnaval,,,1,0,0,desfile_anual,desfile_carnavalesco|licenca_anual
953,grupo carnavalesco estrela de ouro do riachuelo,1913-12-31,31/12/1913,"rua 24 de maio, 224",1,0,6c432,passeata 31/12,,,0,0,0,passeata,passeata
954,congresso dos democraticos,1913-01-13,13/01/1913,"rua josé domingos, 51",1,0,6c432,licença anual,,,1,0,0,licenca_anual,licenca_anual
955,sociedade musical prazer da glória,1913-09-16,16/09/1913,"rua do catete, 257",1,0,6c432,licença anual,,,0,0,0,licenca_anual,licenca_anual
956,sociedade dançante familiar carnavalesca flores abandonadas,1913-01-08,08/01/1913,"rua do estácio de sá, 70",1,0,6c432,licença anual e sair no carnaval,,,0,0,0,desfile_anual,desfile_carnavalesco|licenca_anual
957,sociedade dançante carnavalesca recreio das flores,1913-01-24,24/01/1913,"rua do livramento, 83",0,0,6c432,licença anual,,dario oliveira,0,0,0,licenca_anual,licenca_anual
958,sociedade dançante carnavalesca união da floresta,1913-01-20,20/01/1913,"rua dr. Prudente de morais 133, dr. Frontin",1,0,6c432,licença anual e sair no carnaval,,,0,0,0,desfile_anual,desfile_carnavalesco|licenca_anual
959,grupo carnavalesco estrela da vaidade,1913-01-11,11/01/1913,"rua do morro, 353, estácio de sá",1,0,6c432,sair no carnaval,,,0,0,0,desfile_carnavalesco,desfile_carnavalesco
960,grupo carnavalesco filhos do prazer do castelo,1913-01-07,07/01/1913,"rua do castelo, 42",1,0,6c432,licença anual e sair no carnaval,,,0,0,0,desfile_anual,desfile_carnavalesco|licenca_anual
961,sociedade dançante carnavalesca recreio das flores,1913-01-24,24/01/1913,"rua do livramento, 83",1,0,6c432,licença anual e sair no carnaval,,,0,0,0,desfile_anual,desfile_carnavalesco|licenca_anual
962,clube carnavalesco filhos da flor do caju,1913-01-27,27/01/1913,"praia do cju, 95",1,0,6c432,licença anual e sair no carnaval,empregados fábrica de tecidos bangu,,1,0,0,desfile_anual,desfile_carnavalesco|licenca_anual
963,grêmio amadores da flor de são joão,1913-05-26,26/05/1913,"rua real grandeza, 268",1,0,6c432,"aprovação de estatutos, licença anual",,,0,0,0,estatutos_anual,estatutos|licenca_anual
964,clube recreativo beija flor,1913-02-13,13/02/1913,"rua conde leopoldina, 86",1,0,6c432,licença anual,,,1,0,0,licenca_anual,licenca_anual
965,sociedade carnavalesca familiar união das rosas,1913-01-02,02/01/1913,"rua carlos xavier, 61, d. clara",1,0,6c432,licença anual e sair no carnaval,operarios,,1,0,0,desfile_anual,desfile_carnavalesco|licenca_anual
966,clube carnavalesco filhos da patria,1913-01-07,07/01/1913,"rua barão da gamboa, 19",1,0,6c432,licença anual e sair no carnaval,,,0,0,0,desfile_anual,desfile_carnavalesco|licenca_anual
967,sociedade dançante carnavalesca filhos de chuveiro de prata,1913-01-14,14/01/1913,"rua nova de são luiz, 110",1,0,6c432,sair no carnaval,,,0,0,0,desfile_carnavalesco,desfile_carnavalesco
968,clube parisiense,1912-12-28,28/12/1912,"avenida rio branco, 179",1,0,6c432,aprovação de estatutos e licença anual,,,0,0,0,estatutos_anual,estatutos|licenca_anual
969,sociedade carnavalesca brilho das moças,1913-07-17,17/07/1913,"rua dr. Manoel victorino, 256",1,0,6c432,licença anual,,,0,0,0,licenca_anual,licenca_anual
970,sociedade dançante carnavalesca lirio dos amores,1913-04-29,29/04/1913,"rua maria josé, 113",1,0,6c432,licença anual,,,1,0,0,licenca_anual,licenca_anual
971,clube carnavalesco herois cajueiros,1913-01-16,16/01/1913,"praia do caju, 17",1,0,6c432,passeata dia 26/01,,,0,0,0,passeata,passeata
972,clube dançante carnavalesco flor do amor,1913-01-17,17/01/1913,"rua barão, 55",1,0,6c432,sair no carnaval,operários,,1,0,0,desfile_carnavalesco,desfile_carnavalesco
973,zé-pereira [anúncio cervejaria bohemia],1913-12-31,31/12/1913,"rua senador pompeu, 295",1,0,6c432,sair com zé-pereira 31/12,,,0,0,0,desfile_carnavalesco,desfile_carnavalesco|ze_pereira
974,sociedade dançante carnavalesca flor da romã,1913-01-28,28/01/1913,"rua d. marciana, 153",1,0,6c432,licença anual e sair no carnaval,,,0,0,0,desfile_anual,desfile_carnavalesco|licenca_anual
975,grupo carnavalesco a chave está aqui,1913-01-18,18/01/1913,"rua valença, 48, catumbi",1,0,6c432,sair no carnaval,"socios, moradias e profissões",galdino de oliveira,0,1,0,desfile_carnavalesco,desfile_carnavalesco
